index,text,favorited,favoriteCount,replyToSN,created,truncated,replyToSID,id,replyToUID,statusSource,screenName,retweetCount,isRetweet,retweeted,longitude,latitude
163,The President of Taiwan CALLED ME today to wish me congratulations on winning the Presidency. Thank you!,FALSE,112056,NA,12/3/2016 0:44,FALSE,NA,8.04849E+17,NA,"<a href=""http://twitter.com/download/android"" rel=""nofollow"">Twitter for Android</a>",realDonaldTrump,24977,FALSE,FALSE,NA,NA
164,"Thank you Ohio! Together, we made history – and now, the real work begins. America will start winning again!… https://t.co/sVNSNJE7Uf",FALSE,72632,NA,12/2/2016 2:45,TRUE,NA,8.04517E+17,NA,"<a href=""http://twitter.com/download/iphone"" rel=""nofollow"">Twitter for iPhone</a>",realDonaldTrump,17439,FALSE,FALSE,NA,NA
165,"Heading to U.S. Bank Arena in Cincinnati, Ohio for a 7pm rally. 
Join me! Tickets: https://t.co/HiWqZvHv6M",FALSE,31384,NA,12/1/2016 22:52,FALSE,NA,8.04458E+17,NA,"<a href=""http://twitter.com/download/iphone"" rel=""nofollow"">Twitter for iPhone</a>",realDonaldTrump,5602,FALSE,FALSE,NA,NA
166,Getting ready to leave for the Great State of Indiana and meet the hard working and wonderful people of Carrier A.C.,FALSE,57686,NA,12/1/2016 14:38,FALSE,NA,8.04334E+17,NA,"<a href=""http://twitter.com/download/android"" rel=""nofollow"">Twitter for Android</a>",realDonaldTrump,9926,FALSE,FALSE,NA,NA
167,My thoughts and prayers are with those affected by the tragic storms and tornadoes in the Southeastern United States. Stay safe!,FALSE,66189,NA,12/1/2016 14:37,FALSE,NA,8.04334E+17,NA,"<a href=""http://twitter.com/download/iphone"" rel=""nofollow"">Twitter for iPhone</a>",realDonaldTrump,12181,FALSE,FALSE,NA,NA
168,Look forward to going to Indiana tomorrow in order to be with the great workers of Carrier. They will sell many air conditioners!,FALSE,68132,NA,12/1/2016 3:48,FALSE,NA,8.0417E+17,NA,"<a href=""http://twitter.com/download/android"" rel=""nofollow"">Twitter for Android</a>",realDonaldTrump,12765,FALSE,FALSE,NA,NA
169,'Donald Trump is already helping the working class' https://t.co/GTuNcQhLYx,FALSE,52713,NA,11/30/2016 20:00,FALSE,NA,8.04052E+17,NA,"<a href=""http://twitter.com/download/iphone"" rel=""nofollow"">Twitter for iPhone</a>",realDonaldTrump,14918,FALSE,FALSE,NA,NA
170,"'President-elect Donald J. Trump today announced his intent to nominate Steven Mnuchin, Wilbur Ross &amp; Todd Ricketts… https://t.co/cEBxoWsnYp",FALSE,26147,NA,11/30/2016 16:21,TRUE,NA,8.03997E+17,NA,"<a href=""http://twitter.com/download/iphone"" rel=""nofollow"">Twitter for iPhone</a>",realDonaldTrump,7140,FALSE,FALSE,NA,NA
171,"Join me in Cincinnati, Ohio tomorrow evening at 7:00pm. I am grateful for all of your support. THANK YOU!
Tickets:… https://t.co/51Emq7Tffa",FALSE,30644,NA,11/30/2016 15:23,TRUE,NA,8.03983E+17,NA,"<a href=""http://twitter.com/download/iphone"" rel=""nofollow"">Twitter for iPhone</a>",realDonaldTrump,8072,FALSE,FALSE,NA,NA
172,"Hence, legal documents are being crafted which take me completely out of business operations. The Presidency is a far more important task!",FALSE,78263,NA,11/30/2016 11:59,FALSE,NA,8.03931E+17,NA,"<a href=""http://twitter.com/download/android"" rel=""nofollow"">Twitter for Android</a>",realDonaldTrump,17740,FALSE,FALSE,NA,NA
173,"do this under the law, I feel it is visually important, as President,  to in no way have a conflict of interest with my various businesses..",FALSE,51382,NA,11/30/2016 11:54,FALSE,NA,8.0393E+17,NA,"<a href=""http://twitter.com/download/android"" rel=""nofollow"">Twitter for Android</a>",realDonaldTrump,11382,FALSE,FALSE,NA,NA
174,great business in total in order to fully focus on running the country in order to MAKE AMERICA GREAT AGAIN! While I am not mandated to ....,FALSE,45761,NA,11/30/2016 11:44,FALSE,NA,8.03928E+17,NA,"<a href=""http://twitter.com/download/android"" rel=""nofollow"">Twitter for Android</a>",realDonaldTrump,10780,FALSE,FALSE,NA,NA
175,I will be holding a major news conference in New York City with my children on December 15 to discuss the fact that I will be leaving my ...,FALSE,45607,NA,11/30/2016 11:39,FALSE,NA,8.03926E+17,NA,"<a href=""http://twitter.com/download/android"" rel=""nofollow"">Twitter for Android</a>",realDonaldTrump,11444,FALSE,FALSE,NA,NA
176,ISIS is taking credit for the terrible stabbing attack at Ohio State University by a Somali refugee who should not have been in our country.,FALSE,108708,NA,11/30/2016 11:20,FALSE,NA,8.03922E+17,NA,"<a href=""http://twitter.com/download/android"" rel=""nofollow"">Twitter for Android</a>",realDonaldTrump,34946,FALSE,FALSE,NA,NA
177,Big day on Thursday for Indiana and the great workers of that wonderful state.We will keep our companies and jobs in the U.S. Thanks Carrier,FALSE,84427,NA,11/30/2016 3:50,FALSE,NA,8.03808E+17,NA,"<a href=""http://twitter.com/download/android"" rel=""nofollow"">Twitter for Android</a>",realDonaldTrump,18899,FALSE,FALSE,NA,NA
178,I will be going to Indiana on Thursday to make a major announcement concerning Carrier A.C. staying in Indianapolis. Great deal for workers!,FALSE,70874,NA,11/30/2016 3:40,FALSE,NA,8.03806E+17,NA,"<a href=""http://twitter.com/download/android"" rel=""nofollow"">Twitter for Android</a>",realDonaldTrump,15777,FALSE,FALSE,NA,NA
179,"'President-Elect Donald J. Trump Nominates Elaine Chao as Secretary of the Department of Transportation'
https://t.co/5FMGdhAZxB",FALSE,27913,NA,11/29/2016 23:37,FALSE,NA,8.03745E+17,NA,"<a href=""http://twitter.com/download/iphone"" rel=""nofollow"">Twitter for iPhone</a>",realDonaldTrump,6671,FALSE,FALSE,NA,NA
180,"'President-Elect Donald J. Trump Intends to Nominate Congressman Tom Price and Seema Verma.'
https://t.co/ZTh5cuY26Z https://t.co/twIgAKJs3s",FALSE,24557,NA,11/29/2016 20:59,FALSE,NA,8.03705E+17,NA,"<a href=""http://twitter.com/download/iphone"" rel=""nofollow"">Twitter for iPhone</a>",realDonaldTrump,6717,FALSE,FALSE,NA,NA
181,states instead of the 15 states that I visited. I would have won even more easily and convincingly (but smaller states are forgotten)!,FALSE,48920,NA,11/27/2016 20:41,FALSE,NA,8.02976E+17,NA,"<a href=""http://twitter.com/download/android"" rel=""nofollow"">Twitter for Android</a>",realDonaldTrump,10947,FALSE,FALSE,NA,NA
182,It would have been much easier for me to win the so-called popular vote than the Electoral College in that I would only campaign in 3 or 4--,FALSE,48870,NA,11/27/2016 20:34,FALSE,NA,8.02974E+17,NA,"<a href=""http://twitter.com/download/android"" rel=""nofollow"">Twitter for Android</a>",realDonaldTrump,11676,FALSE,FALSE,NA,NA
183,"In addition to winning the Electoral College in a landslide, I won the popular vote if you deduct the millions of people who voted illegally",FALSE,163648,NA,11/27/2016 20:30,FALSE,NA,8.02973E+17,NA,"<a href=""http://twitter.com/download/android"" rel=""nofollow"">Twitter for Android</a>",realDonaldTrump,54034,FALSE,FALSE,NA,NA
184,"Trump is going to be our President. We owe him an open mind and the chance to lead."" So much time and money will be spent - same result! Sad",FALSE,75301,NA,11/27/2016 13:29,FALSE,NA,8.02867E+17,NA,"<a href=""http://twitter.com/download/android"" rel=""nofollow"">Twitter for Android</a>",realDonaldTrump,17412,FALSE,FALSE,NA,NA
185,"this election. That is a direct threat to our democracy."" She then said, ""We have to accept the results and look to the future, Donald --",FALSE,50610,NA,11/27/2016 13:23,FALSE,NA,8.02865E+17,NA,"<a href=""http://twitter.com/download/android"" rel=""nofollow"">Twitter for Android</a>",realDonaldTrump,12782,FALSE,FALSE,NA,NA
186,"of position."" Then, separately she stated, ""He said something truly horrifying ... he refused to say that he would respect the results of --",FALSE,39609,NA,11/27/2016 13:18,FALSE,NA,8.02864E+17,NA,"<a href=""http://twitter.com/download/android"" rel=""nofollow"">Twitter for Android</a>",realDonaldTrump,9664,FALSE,FALSE,NA,NA
187,"during a general election. I, for one, am appalled that somebody that is the nominee of one of our two major parties would take that kind --",FALSE,38489,NA,11/27/2016 13:08,FALSE,NA,8.02862E+17,NA,"<a href=""http://twitter.com/download/android"" rel=""nofollow"">Twitter for Android</a>",realDonaldTrump,9191,FALSE,FALSE,NA,NA
188,"and fair elections. We've accepted the outcomes when we may not have liked them, and that is what must be expected of anyone standing on a -",FALSE,41637,NA,11/27/2016 13:01,FALSE,NA,8.0286E+17,NA,"<a href=""http://twitter.com/download/android"" rel=""nofollow"">Twitter for Android</a>",realDonaldTrump,10100,FALSE,FALSE,NA,NA
189,"Hillary's debate answer on delay: ""That is horrifying. That is not the way our democracy works. Been around for 240 years. We've had free --",FALSE,44737,NA,11/27/2016 12:55,FALSE,NA,8.02858E+17,NA,"<a href=""http://twitter.com/download/android"" rel=""nofollow"">Twitter for Android</a>",realDonaldTrump,11416,FALSE,FALSE,NA,NA
190,Hillary Clinton conceded the election when she called me just prior to the victory speech and after the results were in. Nothing will change,FALSE,97980,NA,11/27/2016 12:19,FALSE,NA,8.02849E+17,NA,"<a href=""http://twitter.com/download/android"" rel=""nofollow"">Twitter for Android</a>",realDonaldTrump,27090,FALSE,FALSE,NA,NA
191,"The Democrats, when they incorrectly thought they were going to win, asked that the election night tabulation be accepted. Not so anymore!",FALSE,101697,NA,11/27/2016 3:59,FALSE,NA,8.02724E+17,NA,"<a href=""http://twitter.com/download/android"" rel=""nofollow"">Twitter for Android</a>",realDonaldTrump,32026,FALSE,FALSE,NA,NA
192,The Green Party scam to fill up their coffers by asking for impossible recounts is now being joined by the badly defeated &amp; demoralized Dems,FALSE,99439,NA,11/27/2016 0:31,FALSE,NA,8.02671E+17,NA,"<a href=""http://twitter.com/download/android"" rel=""nofollow"">Twitter for Android</a>",realDonaldTrump,32547,FALSE,FALSE,NA,NA
193,Fidel Castro is dead!,FALSE,211970,NA,11/26/2016 13:08,FALSE,NA,8.02499E+17,NA,"<a href=""http://twitter.com/download/android"" rel=""nofollow"">Twitter for Android</a>",realDonaldTrump,100965,FALSE,FALSE,NA,NA
194,"I am working hard, even on Thanksgiving, trying to get Carrier A.C. Company to stay in the U.S. (Indiana). MAKING PROGRESS - Will know soon!",FALSE,140357,NA,11/24/2016 15:11,FALSE,NA,8.01806E+17,NA,"<a href=""http://twitter.com/download/android"" rel=""nofollow"">Twitter for Android</a>",realDonaldTrump,31181,FALSE,FALSE,NA,NA
195,"Happy Thanksgiving to everyone. We will, together, MAKE AMERICA GREAT AGAIN!",FALSE,187507,NA,11/24/2016 3:30,FALSE,NA,8.01629E+17,NA,"<a href=""http://twitter.com/download/android"" rel=""nofollow"">Twitter for Android</a>",realDonaldTrump,49403,FALSE,FALSE,NA,NA
196,"Let us give thanks for all that we have, and let us boldly face the exciting new frontiers that lie ahead. Happy Th… https://t.co/RY9mGGjrXm",FALSE,168251,NA,11/24/2016 2:17,TRUE,NA,8.01611E+17,NA,"<a href=""http://twitter.com/download/iphone"" rel=""nofollow"">Twitter for iPhone</a>",realDonaldTrump,48996,FALSE,FALSE,NA,NA
197,Bus crash in Tennessee so sad &amp; so terrible. Condolences to all family members and loved ones. These beautiful children will be remembered!,FALSE,133615,NA,11/23/2016 0:24,FALSE,NA,8.0122E+17,NA,"<a href=""http://twitter.com/download/android"" rel=""nofollow"">Twitter for Android</a>",realDonaldTrump,27958,FALSE,FALSE,NA,NA
198,I am seriously considering Dr. Ben Carson as the head of HUD. I've gotten to know him well--he's a greatly talented person who loves people!,FALSE,141499,NA,11/22/2016 17:10,FALSE,NA,8.01111E+17,NA,"<a href=""http://twitter.com"" rel=""nofollow"">Twitter Web Client</a>",realDonaldTrump,27382,FALSE,FALSE,NA,NA
199,The meeting with the @nytimes is back on at 12:30 today. Look forward to it!,FALSE,34231,NA,11/22/2016 15:40,FALSE,NA,8.01088E+17,NA,"<a href=""http://twitter.com"" rel=""nofollow"">Twitter Web Client</a>",realDonaldTrump,7290,FALSE,FALSE,NA,NA
200,"'Jeff Sessions, a Fitting Selection for Attorney General'
https://t.co/LjKTkAZSFy",FALSE,38265,NA,11/22/2016 13:39,FALSE,NA,8.01058E+17,NA,"<a href=""http://twitter.com/download/iphone"" rel=""nofollow"">Twitter for iPhone</a>",realDonaldTrump,10611,FALSE,FALSE,NA,NA
201,"'President-elect Donald J. Trump's CIA Director Garners Praise'
https://t.co/UFdLWtwBEQ https://t.co/MrPaG7OziQ",FALSE,31390,NA,11/22/2016 13:38,FALSE,NA,8.01057E+17,NA,"<a href=""http://twitter.com/download/iphone"" rel=""nofollow"">Twitter for iPhone</a>",realDonaldTrump,8692,FALSE,FALSE,NA,NA
202,Great meetings will take place today at Trump Tower concerning the formation of the people who will run our government for the next 8 years.,FALSE,81657,NA,11/22/2016 11:46,FALSE,NA,8.01029E+17,NA,"<a href=""http://twitter.com/download/android"" rel=""nofollow"">Twitter for Android</a>",realDonaldTrump,17284,FALSE,FALSE,NA,NA
203,The failing @nytimes just announced that complaints about them are at a 15 year high. I can fully understand that - but why announce?,FALSE,50416,NA,11/22/2016 11:36,FALSE,NA,8.01027E+17,NA,"<a href=""http://twitter.com/download/android"" rel=""nofollow"">Twitter for Android</a>",realDonaldTrump,12103,FALSE,FALSE,NA,NA
204,Perhaps a new meeting will be set up with the @nytimes. In the meantime they continue to cover me inaccurately and with a nasty tone!,FALSE,39364,NA,11/22/2016 11:31,FALSE,NA,8.01025E+17,NA,"<a href=""http://twitter.com/download/android"" rel=""nofollow"">Twitter for Android</a>",realDonaldTrump,9564,FALSE,FALSE,NA,NA
205,I cancelled today's meeting with the failing @nytimes when the terms and conditions of the meeting were changed at the last moment. Not nice,FALSE,69324,NA,11/22/2016 11:16,FALSE,NA,8.01022E+17,NA,"<a href=""http://twitter.com/download/android"" rel=""nofollow"">Twitter for Android</a>",realDonaldTrump,17607,FALSE,FALSE,NA,NA
206,Many people would like to see @Nigel_Farage represent Great Britain as their Ambassador to the United States. He would do a great job!,FALSE,67161,NA,11/22/2016 2:22,FALSE,NA,8.00887E+17,NA,"<a href=""http://twitter.com/download/android"" rel=""nofollow"">Twitter for Android</a>",realDonaldTrump,22618,FALSE,FALSE,NA,NA
207,Prior to the election it was well known that I have interests in properties all over the world.Only the crooked media makes this a big deal!,FALSE,80310,NA,11/22/2016 2:14,FALSE,NA,8.00885E+17,NA,"<a href=""http://twitter.com/download/android"" rel=""nofollow"">Twitter for Android</a>",realDonaldTrump,19149,FALSE,FALSE,NA,NA
208,.@transition2017 update and policy plans for the first 100 days. https://t.co/HTgPXfPWeJ,FALSE,103332,NA,11/21/2016 23:58,FALSE,NA,8.00851E+17,NA,"<a href=""https://ads.twitter.com"" rel=""nofollow"">Twitter Ads</a>",realDonaldTrump,42386,FALSE,FALSE,NA,NA
209,I have always had a good relationship with Chuck Schumer. He is far smarter than Harry R and has the ability to get things done. Good news!,FALSE,56231,NA,11/20/2016 14:05,FALSE,NA,8.00339E+17,NA,"<a href=""http://twitter.com/download/android"" rel=""nofollow"">Twitter for Android</a>",realDonaldTrump,11566,FALSE,FALSE,NA,NA
210,"General James ""Mad Dog"" Mattis, who is being considered for Secretary of Defense, was very impressive yesterday. A true General's General!",FALSE,83504,NA,11/20/2016 13:39,FALSE,NA,8.00333E+17,NA,"<a href=""http://twitter.com/download/android"" rel=""nofollow"">Twitter for Android</a>",realDonaldTrump,21984,FALSE,FALSE,NA,NA
211,"I watched parts of @nbcsnl Saturday Night Live last night. It is a totally one-sided, biased show - nothing funny at all. Equal time for us?",FALSE,69792,NA,11/20/2016 13:26,FALSE,NA,8.00329E+17,NA,"<a href=""http://twitter.com/download/android"" rel=""nofollow"">Twitter for Android</a>",realDonaldTrump,16222,FALSE,FALSE,NA,NA
212,Numerous patriots will be coming to Bedminster today as I continue to fill out the various positions necessary to MAKE AMERICA GREAT AGAIN!,FALSE,68873,NA,11/20/2016 11:44,FALSE,NA,8.00304E+17,NA,"<a href=""http://twitter.com/download/android"" rel=""nofollow"">Twitter for Android</a>",realDonaldTrump,14111,FALSE,FALSE,NA,NA
213,"The cast and producers of Hamilton, which I hear is highly overrated, should immediately apologize to Mike Pence for their terrible behavior",FALSE,105747,NA,11/20/2016 11:22,FALSE,NA,8.00298E+17,NA,"<a href=""http://twitter.com/download/android"" rel=""nofollow"">Twitter for Android</a>",realDonaldTrump,25893,FALSE,FALSE,NA,NA
214,"The Theater must always be a safe and special place.The cast of Hamilton was very rude last night to a very good man, Mike Pence. Apologize!",FALSE,151792,NA,11/19/2016 13:56,FALSE,NA,7.99975E+17,NA,"<a href=""http://twitter.com/download/android"" rel=""nofollow"">Twitter for Android</a>",realDonaldTrump,44397,FALSE,FALSE,NA,NA
215,"Our wonderful future V.P. Mike Pence was harassed last night at the theater by the cast of Hamilton, cameras blazing.This should not happen!",FALSE,123964,NA,11/19/2016 13:48,FALSE,NA,7.99973E+17,NA,"<a href=""http://twitter.com/download/android"" rel=""nofollow"">Twitter for Android</a>",realDonaldTrump,34389,FALSE,FALSE,NA,NA
216,The ONLY bad thing about winning the Presidency is that I did not have the time to go through a long but winning trial on Trump U. Too bad!,FALSE,63404,NA,11/19/2016 13:39,FALSE,NA,7.9997E+17,NA,"<a href=""http://twitter.com/download/android"" rel=""nofollow"">Twitter for Android</a>",realDonaldTrump,13179,FALSE,FALSE,NA,NA
217,I settled the Trump University lawsuit for a small fraction of the potential award because as President I have to focus on our country.,FALSE,91705,NA,11/19/2016 13:34,FALSE,NA,7.99969E+17,NA,"<a href=""http://twitter.com/download/android"" rel=""nofollow"">Twitter for Android</a>",realDonaldTrump,16536,FALSE,FALSE,NA,NA
218,Will be working all weekend in choosing the great men and women who will be helping to MAKE AMERICA GREAT AGAIN!,FALSE,122861,NA,11/18/2016 22:35,FALSE,NA,7.99743E+17,NA,"<a href=""http://twitter.com/download/android"" rel=""nofollow"">Twitter for Android</a>",realDonaldTrump,26914,FALSE,FALSE,NA,NA
219,I worked hard with Bill Ford to keep the Lincoln plant in Kentucky. I owed it to the great State of Kentucky for their confidence in me!,FALSE,118859,NA,11/18/2016 2:15,FALSE,NA,7.99436E+17,NA,"<a href=""http://twitter.com/download/android"" rel=""nofollow"">Twitter for Android</a>",realDonaldTrump,29518,FALSE,FALSE,NA,NA
220,"Just got a call from my friend Bill Ford, Chairman of Ford, who advised me that he will be keeping the Lincoln plant in Kentucky - no Mexico",FALSE,167911,NA,11/18/2016 2:01,FALSE,NA,7.99432E+17,NA,"<a href=""http://twitter.com/download/android"" rel=""nofollow"">Twitter for Android</a>",realDonaldTrump,49750,FALSE,FALSE,NA,NA
221,"My transition team, which is working long hours and doing a fantastic job, will be seeing many great candidates today. #MAGA",FALSE,97448,NA,11/17/2016 12:46,FALSE,NA,7.99232E+17,NA,"<a href=""http://twitter.com/download/android"" rel=""nofollow"">Twitter for Android</a>",realDonaldTrump,21424,FALSE,FALSE,NA,NA
222,"Australia, New Zealand, and more. I am always available to them. @nytimes is just upset that they looked like fools in their coverage of me.",FALSE,91610,NA,11/16/2016 12:25,FALSE,NA,7.98865E+17,NA,"<a href=""http://twitter.com/download/android"" rel=""nofollow"">Twitter for Android</a>",realDonaldTrump,24418,FALSE,FALSE,NA,NA
223,"I have recieved and taken calls from many foreign leaders despite what the failing @nytimes said. Russia, U.K., China, Saudi Arabia, Japan,",FALSE,89684,NA,11/16/2016 12:17,FALSE,NA,7.98862E+17,NA,"<a href=""http://twitter.com/download/android"" rel=""nofollow"">Twitter for Android</a>",realDonaldTrump,26008,FALSE,FALSE,NA,NA
224,"The failing @nytimes story is so totally wrong on transition. It is going so smoothly. Also, I have spoken to many foreign leaders.",FALSE,78359,NA,11/16/2016 12:12,FALSE,NA,7.98861E+17,NA,"<a href=""http://twitter.com/download/android"" rel=""nofollow"">Twitter for Android</a>",realDonaldTrump,21095,FALSE,FALSE,NA,NA
225,"I am not trying to get ""top level security clearance"" for my children. This was a typically false news story.",FALSE,100981,NA,11/16/2016 11:28,FALSE,NA,7.9885E+17,NA,"<a href=""http://twitter.com/download/android"" rel=""nofollow"">Twitter for Android</a>",realDonaldTrump,31532,FALSE,FALSE,NA,NA
226,Very organized process taking place as I decide on Cabinet and many other positions. I am the only one who knows who the finalists are!,FALSE,120797,NA,11/16/2016 2:55,FALSE,NA,7.98721E+17,NA,"<a href=""http://twitter.com/download/android"" rel=""nofollow"">Twitter for Android</a>",realDonaldTrump,27834,FALSE,FALSE,NA,NA
227,"The Electoral College is actually genius in that it brings all states, including the smaller ones, into play. Campaigning is much different!",FALSE,129344,NA,11/15/2016 13:40,FALSE,NA,7.98521E+17,NA,"<a href=""http://twitter.com/download/android"" rel=""nofollow"">Twitter for Android</a>",realDonaldTrump,39696,FALSE,FALSE,NA,NA
228,If the election were based on total popular vote I would have campaigned in  N.Y. Florida and California and won even bigger and more easily,FALSE,181084,NA,11/15/2016 13:34,FALSE,NA,7.9852E+17,NA,"<a href=""http://twitter.com/download/android"" rel=""nofollow"">Twitter for Android</a>",realDonaldTrump,50464,FALSE,FALSE,NA,NA
229,"The debates, especially the second and third, plus speeches and intensity of the large rallies, plus OUR GREAT SUPPORTERS, gave us the win!",FALSE,114358,NA,11/13/2016 18:46,FALSE,NA,7.97873E+17,NA,"<a href=""http://twitter.com/download/iphone"" rel=""nofollow"">Twitter for iPhone</a>",realDonaldTrump,23700,FALSE,FALSE,NA,NA
230,I will be interviewed on @60Minutes tonight after the NFL game - 7:00 P.M. Enjoy!,FALSE,78882,NA,11/13/2016 16:33,FALSE,NA,7.9784E+17,NA,"<a href=""http://twitter.com/download/android"" rel=""nofollow"">Twitter for Android</a>",realDonaldTrump,16604,FALSE,FALSE,NA,NA
231,"The @nytimes states today that DJT believes ""more countries should acquire nuclear weapons."" How dishonest are they. I never said this!",FALSE,94549,NA,11/13/2016 16:03,FALSE,NA,7.97832E+17,NA,"<a href=""http://twitter.com/download/android"" rel=""nofollow"">Twitter for Android</a>",realDonaldTrump,29725,FALSE,FALSE,NA,NA
232,"Governor John Kasich of the GREAT, GREAT, GREAT State of Ohio called to congratulate me on the win. The people of Ohio were incredible!",FALSE,125808,NA,11/13/2016 15:28,FALSE,NA,7.97824E+17,NA,"<a href=""http://twitter.com/download/android"" rel=""nofollow"">Twitter for Android</a>",realDonaldTrump,22909,FALSE,FALSE,NA,NA
233,"Jeb Bush, George W and George H.W. all called to express their best wishes on the win. Very nice!",FALSE,108492,NA,11/13/2016 15:23,FALSE,NA,7.97822E+17,NA,"<a href=""http://twitter.com/download/android"" rel=""nofollow"">Twitter for Android</a>",realDonaldTrump,18325,FALSE,FALSE,NA,NA
234,Mitt Romney called to congratulate me on the win. Very nice!,FALSE,111767,NA,11/13/2016 14:45,FALSE,NA,7.97813E+17,NA,"<a href=""http://twitter.com/download/android"" rel=""nofollow"">Twitter for Android</a>",realDonaldTrump,15661,FALSE,FALSE,NA,NA
235,The @nytimes sent a letter to their subscribers apologizing for their BAD coverage of me. I wonder if it will change - doubt it?,FALSE,87922,NA,11/13/2016 14:43,FALSE,NA,7.97812E+17,NA,"<a href=""http://twitter.com/download/android"" rel=""nofollow"">Twitter for Android</a>",realDonaldTrump,22443,FALSE,FALSE,NA,NA
236,"Wow, the @nytimes is losing thousands of subscribers because of their very poor and highly inaccurate coverage of the ""Trump phenomena""",FALSE,128591,NA,11/13/2016 14:16,FALSE,NA,7.97805E+17,NA,"<a href=""http://twitter.com/download/android"" rel=""nofollow"">Twitter for Android</a>",realDonaldTrump,35474,FALSE,FALSE,NA,NA
237,"This will prove to be a great time in the lives of ALL Americans. We will unite and we will win, win, win!",FALSE,203622,NA,11/12/2016 15:05,FALSE,NA,7.97455E+17,NA,"<a href=""http://twitter.com/download/android"" rel=""nofollow"">Twitter for Android</a>",realDonaldTrump,54328,FALSE,FALSE,NA,NA
238,Today we express our deepest gratitude to all those who have served in our armed forces. #ThankAVet https://t.co/wPk7QWpK8Z,FALSE,170376,NA,11/11/2016 15:26,FALSE,NA,7.97098E+17,NA,"<a href=""http://twitter.com/download/iphone"" rel=""nofollow"">Twitter for iPhone</a>",realDonaldTrump,47716,FALSE,FALSE,NA,NA
239,Busy day planned in New York. Will soon be making some very important decisions on the people who will be running our government!,FALSE,179878,NA,11/11/2016 13:33,FALSE,NA,7.9707E+17,NA,"<a href=""http://twitter.com/download/android"" rel=""nofollow"">Twitter for Android</a>",realDonaldTrump,33729,FALSE,FALSE,NA,NA
240,Love the fact that the small groups of protesters last night have passion for our great country. We will all come together and be proud!,FALSE,223784,NA,11/11/2016 11:14,FALSE,NA,7.97035E+17,NA,"<a href=""http://twitter.com/download/android"" rel=""nofollow"">Twitter for Android</a>",realDonaldTrump,56879,FALSE,FALSE,NA,NA
241,"Just had a very open and successful presidential election. Now professional protesters, incited by the media, are protesting. Very unfair!",FALSE,233777,NA,11/11/2016 2:19,FALSE,NA,7.969E+17,NA,"<a href=""http://twitter.com/download/android"" rel=""nofollow"">Twitter for Android</a>",realDonaldTrump,70504,FALSE,FALSE,NA,NA
242,"A fantastic day in D.C. Met with President Obama for first time. Really good meeting, great chemistry. Melania liked Mrs. O a lot!",FALSE,194363,NA,11/11/2016 2:10,FALSE,NA,7.96898E+17,NA,"<a href=""http://twitter.com/download/android"" rel=""nofollow"">Twitter for Android</a>",realDonaldTrump,38332,FALSE,FALSE,NA,NA
